ALARA 2.9.2
Set verbose level to 3.
Opened tree file output/sample4.tree.
	Opened sample4 for input.
Starting problem input processing.
	Reading input.
		Set geometry type: spherical.
		Reading zone boundaries for Dimension r:
		Reading the material loading for this problem.
		Reading constituent list for Mixture target with constituents:
		Reading constituent list for Mixture wall with constituents:
		Opened material library ./data/sampleMatlib
		Opened element library ./data/myElelib
		Added Flux target_flux from file data/hohlflux with normalization 1e-10, format code 1, and skipping 90 entries.
		Openning DataLib with type alaralib
		Reading after-shutdown cooling times.
		Reading pulsing levels for History part_a:
		Reading pulsing levels for History once:
		Reading items for schedule problem_1_a.
		Added output at resolution 2 (zone)
		Truncation parameters set at 1e-08 for truncation and 1e-10 for ignore.
	Cross-checking input for completeness and self-consistency.
		Checking for all internally referenced mixtures.
		Checking for all mixtures referenced in material loading.
		Checking that dimension types match geometry type: Spherical.
		Number of zones defined by zone dimensions (3) matches number of material loadings defined.(3)
		Checking for all sub-schedules, fluxes and pulsing histories referenced in schedules.


***Please review this schedule hierarchy.!!!!!!!!!!

Schedule 'problem_1_a':
	pulse_entry: 1 d pulse_history part_a delay 25 d
	pulse_entry: 5 m pulse_history once delay 0 d

***End of schedule hierarchy.


	Preprocessing input.
		Replacing all 'similar' constituents and removing unused mixtures.
		Converting zone boundaries into list of intervals.
		Cross-referencing intervals with mixtures.
		Assigning 1 fluxes to each interval
		Making list of root isotopes.
		Processing pulsing histories.
pulse_history: 'part_a
num_pulsing_levels: 1
num_pulses_per_level: [25]
delay_seconds_per_level: [90000]
pulse_history: 'once
num_pulsing_levels: 1
num_pulses_per_level: [1]
delay_seconds_per_level: [0]
		Processing schedule hierarchy.
		Processing cooling times.
		Collapsing schedules from top.
		Making storage hierarchies in intervals.
Starting problem solution.
		Solving Root #1: h-1 
		   Maximum relative concentration: 0.132504
		      last Root: 4 nodes in 2 chains with maximum length 3.
		   Total so far: 4 nodes in 2 chains with maximum length 3.
		Solving Root #2: h-2 
		   Maximum relative concentration: 1.98786e-05
		      last Root: 6 nodes in 3 chains with maximum length 3.
		   Total so far: 10 nodes in 5 chains with maximum length 3.
		Solving Root #3: c-12 
		   Maximum relative concentration: 0.0813816
		      last Root: 44 nodes in 12 chains with maximum length 4.
		   Total so far: 54 nodes in 17 chains with maximum length 4.
		Solving Root #4: c-13 
		   Maximum relative concentration: 0.000911811
		      last Root: 115 nodes in 28 chains with maximum length 5.
		   Total so far: 169 nodes in 45 chains with maximum length 5.
		Solving Root #5: n-14 
		   Maximum relative concentration: 0.0014928
		      last Root: 153 nodes in 59 chains with maximum length 5.
		   Total so far: 322 nodes in 104 chains with maximum length 5.
		Solving Root #6: n-15 
		   Maximum relative concentration: 5.48372e-06
		      last Root: 150 nodes in 55 chains with maximum length 5.
		   Total so far: 472 nodes in 159 chains with maximum length 5.
		Solving Root #7: o-16 
		   Maximum relative concentration: 0.547342
		      last Root: 132 nodes in 44 chains with maximum length 5.
		   Total so far: 604 nodes in 203 chains with maximum length 5.
		Solving Root #8: o-17 
		   Maximum relative concentration: 0.000203006
		      last Root: 166 nodes in 60 chains with maximum length 5.
		   Total so far: 770 nodes in 263 chains with maximum length 5.
		Solving Root #9: o-18 
		   Maximum relative concentration: 0.00111927
		      last Root: 148 nodes in 39 chains with maximum length 5.
		   Total so far: 918 nodes in 302 chains with maximum length 5.
		Solving Root #10: na-23 
		   Maximum relative concentration: 0.00325361
		      last Root: 301 nodes in 95 chains with maximum length 7.
		   Total so far: 1219 nodes in 397 chains with maximum length 7.
		Solving Root #11: mg-24 
		   Maximum relative concentration: 0.00856623
		      last Root: 441 nodes in 104 chains with maximum length 7.
		   Total so far: 1660 nodes in 501 chains with maximum length 7.
		Solving Root #12: mg-25 
		   Maximum relative concentration: 0.00108447
		      last Root: 366 nodes in 93 chains with maximum length 7.
		   Total so far: 2026 nodes in 594 chains with maximum length 7.
		Solving Root #13: mg-26 
		   Maximum relative concentration: 0.001194
		      last Root: 215 nodes in 55 chains with maximum length 6.
		   Total so far: 2241 nodes in 649 chains with maximum length 7.
		Solving Root #14: al-27 
		   Maximum relative concentration: 0.0135973
		      last Root: 382 nodes in 112 chains with maximum length 7.
		   Total so far: 2623 nodes in 761 chains with maximum length 7.
		Solving Root #15: si-28 
		   Maximum relative concentration: 0.0918208
		      last Root: 223 nodes in 65 chains with maximum length 6.
		   Total so far: 2846 nodes in 826 chains with maximum length 7.
		Solving Root #16: si-29 
		   Maximum relative concentration: 0.00464928
		      last Root: 266 nodes in 65 chains with maximum length 6.
		   Total so far: 3112 nodes in 891 chains with maximum length 7.
		Solving Root #17: si-30 
		   Maximum relative concentration: 0.00308625
		      last Root: 217 nodes in 64 chains with maximum length 6.
		   Total so far: 3329 nodes in 955 chains with maximum length 7.
		Solving Root #18: p-31 
		   Maximum relative concentration: 0.000463581
		      last Root: 345 nodes in 88 chains with maximum length 6.
		   Total so far: 3674 nodes in 1043 chains with maximum length 7.
		Solving Root #19: s-32 
		   Maximum relative concentration: 0.000897329
		      last Root: 466 nodes in 105 chains with maximum length 6.
		   Total so far: 4140 nodes in 1148 chains with maximum length 7.
		Solving Root #20: s-33 
		   Maximum relative concentration: 7.08269e-06
		      last Root: 583 nodes in 126 chains with maximum length 6.
		   Total so far: 4723 nodes in 1274 chains with maximum length 7.
		Solving Root #21: s-34 
		   Maximum relative concentration: 3.97575e-05
		      last Root: 431 nodes in 94 chains with maximum length 6.
		   Total so far: 5154 nodes in 1368 chains with maximum length 7.
		Solving Root #22: s-36 
		   Maximum relative concentration: 1.88872e-07
		      last Root: 257 nodes in 64 chains with maximum length 6.
		   Total so far: 5411 nodes in 1432 chains with maximum length 7.
		Solving Root #23: k-39 
		   Maximum relative concentration: 0.00318596
		      last Root: 541 nodes in 105 chains with maximum length 6.
		   Total so far: 5952 nodes in 1537 chains with maximum length 7.
		Solving Root #24: k-41 
		   Maximum relative concentration: 0.000230258
		      last Root: 483 nodes in 110 chains with maximum length 7.
		   Total so far: 6435 nodes in 1647 chains with maximum length 7.
		Solving Root #25: ca-40 
		   Maximum relative concentration: 0.0988584
		      last Root: 556 nodes in 111 chains with maximum length 5.
		   Total so far: 6991 nodes in 1758 chains with maximum length 7.
		Solving Root #26: ca-42 
		   Maximum relative concentration: 0.000659797
		      last Root: 595 nodes in 112 chains with maximum length 6.
		   Total so far: 7586 nodes in 1870 chains with maximum length 7.
		Solving Root #27: ca-43 
		   Maximum relative concentration: 0.00013767
		      last Root: 384 nodes in 86 chains with maximum length 6.
		   Total so far: 7970 nodes in 1956 chains with maximum length 7.
		Solving Root #28: ca-44 
		   Maximum relative concentration: 0.00212726
		      last Root: 307 nodes in 66 chains with maximum length 6.
		   Total so far: 8277 nodes in 2022 chains with maximum length 7.
		Solving Root #29: ca-46 
		   Maximum relative concentration: 4.07912e-06
		      last Root: 263 nodes in 58 chains with maximum length 6.
		   Total so far: 8540 nodes in 2080 chains with maximum length 7.
		Solving Root #30: ca-48 
		   Maximum relative concentration: 0.000190699
		      last Root: 292 nodes in 55 chains with maximum length 7.
		   Total so far: 8832 nodes in 2135 chains with maximum length 7.
		Solving Root #31: ti-46 
		   Maximum relative concentration: 2.76708e-05
		      last Root: 712 nodes in 159 chains with maximum length 7.
		   Total so far: 9544 nodes in 2294 chains with maximum length 7.
		Solving Root #32: ti-47 
		   Maximum relative concentration: 2.52496e-05
		      last Root: 538 nodes in 127 chains with maximum length 7.
		   Total so far: 10082 nodes in 2421 chains with maximum length 7.
		Solving Root #33: ti-48 
		   Maximum relative concentration: 0.000255263
		      last Root: 340 nodes in 86 chains with maximum length 6.
		   Total so far: 10422 nodes in 2507 chains with maximum length 7.
		Solving Root #34: ti-49 
		   Maximum relative concentration: 1.90237e-05
		      last Root: 312 nodes in 58 chains with maximum length 5.
		   Total so far: 10734 nodes in 2565 chains with maximum length 7.
		Solving Root #35: ti-50 
		   Maximum relative concentration: 1.86778e-05
		      last Root: 219 nodes in 49 chains with maximum length 6.
		   Total so far: 10953 nodes in 2614 chains with maximum length 7.
		Solving Root #36: cr-50 
		   Maximum relative concentration: 0.00816845
		      last Root: 492 nodes in 104 chains with maximum length 5.
		   Total so far: 11445 nodes in 2718 chains with maximum length 7.
		Solving Root #37: cr-52 
		   Maximum relative concentration: 0.157522
		      last Root: 303 nodes in 76 chains with maximum length 6.
		   Total so far: 11748 nodes in 2794 chains with maximum length 7.
		Solving Root #38: cr-53 
		   Maximum relative concentration: 0.0178597
		      last Root: 279 nodes in 74 chains with maximum length 5.
		   Total so far: 12027 nodes in 2868 chains with maximum length 7.
		Solving Root #39: cr-54 
		   Maximum relative concentration: 0.00444612
		      last Root: 218 nodes in 56 chains with maximum length 5.
		   Total so far: 12245 nodes in 2924 chains with maximum length 7.
		Solving Root #40: mn-55 
		   Maximum relative concentration: 0.0117614
		      last Root: 287 nodes in 77 chains with maximum length 6.
		   Total so far: 12532 nodes in 3001 chains with maximum length 7.
		Solving Root #41: fe-54 
		   Maximum relative concentration: 0.0411783
		      last Root: 467 nodes in 110 chains with maximum length 5.
		   Total so far: 12999 nodes in 3111 chains with maximum length 7.
		Solving Root #42: fe-56 
		   Maximum relative concentration: 0.640148
		      last Root: 247 nodes in 70 chains with maximum length 6.
		   Total so far: 13246 nodes in 3181 chains with maximum length 7.
		Solving Root #43: fe-57 
		   Maximum relative concentration: 0.0146567
		      last Root: 265 nodes in 63 chains with maximum length 5.
		   Total so far: 13511 nodes in 3244 chains with maximum length 7.
		Solving Root #44: fe-58 
		   Maximum relative concentration: 0.00195422
		      last Root: 282 nodes in 64 chains with maximum length 6.
		   Total so far: 13793 nodes in 3308 chains with maximum length 7.
		Solving Root #45: co-59 
		   Maximum relative concentration: 0.000937101
		      last Root: 755 nodes in 161 chains with maximum length 7.
		   Total so far: 14548 nodes in 3469 chains with maximum length 7.
		Solving Root #46: ni-58 
		   Maximum relative concentration: 0.059734
		      last Root: 848 nodes in 179 chains with maximum length 7.
		   Total so far: 15396 nodes in 3648 chains with maximum length 7.
		Solving Root #47: ni-60 
		   Maximum relative concentration: 0.0228366
		      last Root: 496 nodes in 113 chains with maximum length 6.
		   Total so far: 15892 nodes in 3761 chains with maximum length 7.
		Solving Root #48: ni-61 
		   Maximum relative concentration: 0.000988712
		      last Root: 513 nodes in 108 chains with maximum length 6.
		   Total so far: 16405 nodes in 3869 chains with maximum length 7.
		Solving Root #49: ni-62 
		   Maximum relative concentration: 0.00314113
		      last Root: 389 nodes in 90 chains with maximum length 6.
		   Total so far: 16794 nodes in 3959 chains with maximum length 7.
		Solving Root #50: ni-64 
		   Maximum relative concentration: 0.00079622
		      last Root: 266 nodes in 60 chains with maximum length 7.
		   Total so far: 17060 nodes in 4019 chains with maximum length 7.
	Solved problem.
	Reset binary dump with 6 results per isotope.
		Read dump file.
		Tallying constituent results into total result lists.
Zone output requested:
	Response Units: Ci /m3
	WDR/Clearance index: data/NRCA
	WDR/Clearance index: data/NRCC


*** WDR ***
*** WDR/Clearance index: data/NRCA ***

Zone #1: SOURCE_REGION

Zone #2: HOHLRAUM_WALL
	Relative Volume: 0.523565
	Containing mixture: target

Total (All constituents) 
	COMPACTED
	Volume Fraction: 1	Relative Volume: 0.523565
WDR/Clearance index: data/NRCA
isotope  t_1/2(s)   pre-irrad   shutdown         1 s         1 d         1 y        10 y       100 y   
======================================================================================================
h-3 	3.8911e+08  0.0000e+00  2.6242e+00  2.6242e+00  2.6238e+00  2.4812e+00  1.4986e+00  9.6806e-03  
c-14 	1.8082e+11  0.0000e+00  2.7006e-01  2.7006e-01  2.7006e-01  2.7002e-01  2.6973e-01  2.6682e-01  
co-60 	1.6636e+08  0.0000e+00  8.4814e+00  8.4814e+00  8.4789e+00  7.4402e+00  2.2878e+00  1.7289e-05  
ni-59 	2.3984e+12  0.0000e+00  4.4751e-01  4.4751e-01  4.4751e-01  4.4751e-01  4.4747e-01  4.4710e-01  
ni-63 	3.1242e+09  0.0000e+00  2.0868e+01  2.0868e+01  2.0868e+01  2.0723e+01  1.9462e+01  1.0386e+01  
======================================================================================================
total   0           0.0000e+00  3.2692e+01  3.2692e+01  3.2688e+01  3.1362e+01  2.3966e+01  1.1110e+01  

Zone #3: LIQUID_WALL
	Relative Volume: 0.00472654
	Containing mixture: wall

Total (All constituents) 
	COMPACTED
	Volume Fraction: 1	Relative Volume: 0.00472654
WDR/Clearance index: data/NRCA
isotope  t_1/2(s)   pre-irrad   shutdown         1 s         1 d         1 y        10 y       100 y   
======================================================================================================
h-3 	3.8911e+08  0.0000e+00  1.2593e+00  1.2593e+00  1.2591e+00  1.1907e+00  7.1917e-01  4.6457e-03  
c-14 	1.8082e+11  0.0000e+00  9.8000e-02  9.8000e-02  9.8000e-02  9.7988e-02  9.7881e-02  9.6825e-02  
co-60 	1.6636e+08  0.0000e+00  8.2710e-09  8.2710e-09  8.2707e-09  7.2576e-09  2.2317e-09  1.6864e-14  
======================================================================================================
total   0           0.0000e+00  1.3573e+00  1.3573e+00  1.3571e+00  1.2887e+00  8.1705e-01  1.0147e-01  

Totals for all zones.
WDR/Clearance index: data/NRCA
zone	 shutdown         1 s         1 d         1 y        10 y       100 y   
======================================================================================================
1		SOURCE_REGION (void)
2	3.2692e+01  3.2692e+01  3.2688e+01  3.1362e+01  2.3966e+01  1.1110e+01  	HOHLRAUM_WALL (target)
3	1.3573e+00  1.3573e+00  1.3571e+00  1.2887e+00  8.1705e-01  1.0147e-01  	LIQUID_WALL (wall)
======================================================================================================





*** WDR/Clearance index: data/NRCC ***

Zone #1: SOURCE_REGION

Zone #2: HOHLRAUM_WALL
	Relative Volume: 0.523565
	Containing mixture: target

Total (All constituents) 
	COMPACTED
	Volume Fraction: 1	Relative Volume: 0.523565
WDR/Clearance index: data/NRCC
isotope  t_1/2(s)   pre-irrad   shutdown         1 s         1 d         1 y        10 y       100 y   
======================================================================================================
c-14 	1.8082e+11  0.0000e+00  2.7006e-02  2.7006e-02  2.7006e-02  2.7002e-02  2.6973e-02  2.6682e-02  
ni-59 	2.3984e+12  0.0000e+00  4.4751e-02  4.4751e-02  4.4751e-02  4.4751e-02  4.4747e-02  4.4710e-02  
ni-63 	3.1242e+09  0.0000e+00  1.0434e-01  1.0434e-01  1.0434e-01  1.0362e-01  9.7310e-02  5.1931e-02  
======================================================================================================
total   0           0.0000e+00  1.7610e-01  1.7610e-01  1.7610e-01  1.7537e-01  1.6903e-01  1.2332e-01  

Zone #3: LIQUID_WALL
	Relative Volume: 0.00472654
	Containing mixture: wall

Total (All constituents) 
	COMPACTED
	Volume Fraction: 1	Relative Volume: 0.00472654
WDR/Clearance index: data/NRCC
isotope  t_1/2(s)   pre-irrad   shutdown         1 s         1 d         1 y        10 y       100 y   
======================================================================================================
c-14 	1.8082e+11  0.0000e+00  9.8000e-03  9.8000e-03  9.8000e-03  9.7988e-03  9.7881e-03  9.6825e-03  
======================================================================================================
total   0           0.0000e+00  9.8000e-03  9.8000e-03  9.8000e-03  9.7988e-03  9.7881e-03  9.6825e-03  

Totals for all zones.
WDR/Clearance index: data/NRCC
zone	 shutdown         1 s         1 d         1 y        10 y       100 y   
======================================================================================================
1		SOURCE_REGION (void)
2	1.7610e-01  1.7610e-01  1.7610e-01  1.7537e-01  1.6903e-01  1.2332e-01  	HOHLRAUM_WALL (target)
3	9.8000e-03  9.8000e-03  9.8000e-03  9.7988e-03  9.7881e-03  9.6825e-03  	LIQUID_WALL (wall)
======================================================================================================





Output.
